<?xml version="1.0" encoding="UTF-8"?>
<dt:data xmlns:dt="http://example.com/decoder"
         xmlns:xsi="http://www.w3.org/2001/XMLSchema-instance"
         xsi:schemaLocation="http://example.com/decoder  ./decoder.xsd">
    <decimal_value>1</decimal_value>
    <certification Year="1999">ISO-9001</certification>
    <certification Year="2009">ISO-27001</certification>
    <menù>baccalà mantecato</menù>
    <complex_boolean Type="2">true</complex_boolean>
    <complex_boolean Type="1">false</complex_boolean>
    <complex_boolean>true</complex_boolean>
    <complex_boolean>false</complex_boolean>
    <simple_boolean>true</simple_boolean>
    <simple_boolean>false</simple_boolean>
</dt:data>
